{
  "level": "C1.2",
  "cefr_level": "C1",
  "institution": "Iberia Language Academy",
  "source_file": "Programa C1.2 página web.pdf",
  "hours": 80,
  "textbook": null,
  "communicative_objectives": [
    "Mediar en conflictos relacionados con la comunicación",
    "Reflexionar sobre malentendidos",
    "Hablar del humor y su función comunicativa",
    "Gestionar la comunicación en el trabajo en grupo",
    "Describir y repartir roles en contextos cooperativos",
    "Redactar mensajes en un registro profesional",
    "Hablar sobre la identidad individual y colectiva",
    "Hablar de cambios sociales y urbanos",
    "Expresar y debatir normas",
    "Establecer condiciones",
    "Comparar situaciones y procesos",
    "Redactar textos normativos y participar en foros y redes sociales"
  ],
  "units": [],
  "exam_prep": null
}
