{
  "level": "C1.2+",
  "cefr_level": "C1",
  "institution": "Iberia Language Academy",
  "source_file": "Programa C1.2+ página web.pdf",
  "hours": 80,
  "textbook": null,
  "communicative_objectives": [
    "Describir y comentar obras de arte",
    "Reflexionar sobre la función y la finalidad del arte",
    "Expresar gustos e intereses culturales",
    "Opinar y valorar manifestaciones artísticas",
    "Formular hipótesis sobre el significado o la interpretación de una obra",
    "Participar en debates culturales",
    "Hablar de alimentos y platos: descripción, origen e historia",
    "Valorar la calidad de un producto gastronómico",
    "Atenuar críticas",
    "Expresar sorpresa",
    "Idear y presentar una experiencia gastronómica",
    "Argumentar y justificar valoraciones",
    "Expresar deseos",
    "Hablar de malestares, sus causas y posibles soluciones",
    "Expresar emociones y sentimientos",
    "Hablar de condiciones de vida",
    "Expresar satisfacción o insatisfacción",
    "Presentar y defender un plan de bienestar para una comunidad"
  ],
  "units": [],
  "exam_prep": null
}
