{
  "level": "C1.1+",
  "cefr_level": "C1",
  "institution": "Iberia Language Academy",
  "source_file": "Programa C1.1+ página web.pdf",
  "hours": 80,
  "textbook": null,
  "communicative_objectives": [
    "Expresar ironía",
    "Expresar acuerdo y desacuerdo",
    "Corregir y cuestionar una información",
    "Valorar la fiabilidad de informaciones y fuentes",
    "Hablar de información y desinformación",
    "Presentar y analizar teorías de la conspiración",
    "Hablar de las etapas de la vida",
    "Reflexionar sobre la concepción del tiempo",
    "Hablar de la gestión del tiempo",
    "Dar consejos",
    "Definir conceptos abstractos relacionados con el tiempo",
    "Expresar y reinterpretar momentos vitales en un texto literario"
  ],
  "units": [],
  "exam_prep": null
}
