{
  "level": "B2.2",
  "cefr_level": "B2",
  "institution": "Iberia Language Academy",
  "source_file": "Programa B2.2 página web.pdf",
  "hours": 60,
  "textbook": null,
  "communicative_objectives": [
    "Describir actividades y movimientos",
    "Dar instrucciones",
    "Hablar de la postura corporal",
    "Expresar sentimientos y estados de ánimo",
    "Presentar y describir acciones físicas en un contexto artístico o creativo",
    "Expresar finalidad",
    "Expresar intencionalidad",
    "Aludir a promesas en estilo indirecto",
    "Reclamar el cumplimiento de un compromiso",
    "Presentar casos de mediación",
    "Proponer y evaluar soluciones a un conflicto",
    "Transmitir oralmente una conversación",
    "Referir eventos pasados",
    "Combinar distintos tiempos del pasado",
    "Contar relatos (historias, cuentos, leyendas)",
    "Transmitir peticiones y advertencias",
    "Narrar acontecimientos relacionados con una ciudad o un barrio",
    "Contar hechos históricos o experiencias colectivas"
  ],
  "units": [],
  "exam_prep": null
}
