{
  "level": "A1.2",
  "cefr_level": "A1",
  "institution": "Iberia Language Academy",
  "source_file": "PROGRAMA A1.2_Alumnos.pdf",
  "hours": 40,
  "textbook": {
    "name": "Aula Plus 1",
    "units_covered": [5, 6, 7, 8]
  },
  "communicative_objectives": [
    "Presentar y describir a una persona",
    "Hablar del aspecto y del carácter",
    "Expresar y contrastar gustos e intereses",
    "Preguntar sobre gustos",
    "Hablar de relaciones personales",
    "Conocer los hábitos de las personas de la clase y dar premios",
    "Hablar de hábitos",
    "Expresar frecuencia",
    "Preguntar y decir la hora",
    "Crear un menú del día y elegir los platos que nos gustan",
    "Desenvolverse en bares y restaurantes",
    "Pedir y dar información sobre comida",
    "Hablar de hábitos gastronómicos",
    "Imaginar y describir un barrio ideal",
    "Describir pueblos, barrios y ciudades",
    "Hablar de lo que más nos gusta de un lugar",
    "Pedir y dar información para llegar a un sitio",
    "Expresar gustos y resaltar un aspecto"
  ],
  "units": [],
  "exam_prep": null
}
