{
  "level": "C1.1",
  "cefr_level": "C1",
  "institution": "Iberia Language Academy",
  "source_file": "Programa C1.1 página web.pdf",
  "hours": 80,
  "textbook": null,
  "communicative_objectives": [
    "Presentar contraargumentos y matizar una opinión",
    "Expresar acuerdo total y acuerdo parcial",
    "Describir y analizar fenómenos lingüísticos",
    "Hablar de la evolución de la lengua",
    "Valorar y presentar tendencias lingüísticas de forma argumentada",
    "Hablar de música y sonidos desde una perspectiva personal y cultural",
    "Relatar recuerdos y experiencias transformadoras",
    "Relativizar la exactitud o fiabilidad de lo que se dice",
    "Expresar preferencias y gustos personales",
    "Describir sensaciones y emociones vinculadas a experiencias sonoras"
  ],
  "units": [],
  "exam_prep": null
}
