{
  "level": "B2.1",
  "cefr_level": "B2",
  "institution": "Iberia Language Academy",
  "source_file": "Programa B2.1.pdf",
  "hours": 60,
  "textbook": null,
  "communicative_objectives": [
    "Redactar y comentar noticias de actualidad utilizando estructuras adecuadas y vocabulario periodístico",
    "Expresar opiniones, acuerdos y desacuerdos con matices",
    "Participar en una asamblea o debate, proponiendo, aceptando y rechazando ideas",
    "Utilizar adecuadamente los tiempos del pasado para narrar y relatar hechos",
    "Usar la voz pasiva y las construcciones impersonales para informar objetivamente",
    "Formular hipótesis y condiciones utilizando el subjuntivo y las oraciones condicionales",
    "Expresar deseos, desconocimiento y dar consejos mediante estructuras complejas",
    "Argumentar sobre temas sociales y culturales con un registro formal",
    "Describir costumbres y tradiciones culturales del mundo hispanohablante",
    "Utilizar expresiones idiomáticas relacionadas con la emoción, la sorpresa y el rechazo",
    "Incorporar conectores discursivos que den coherencia y cohesión al discurso",
    "Mejorar la fluidez y la pronunciación en la expresión oral",
    "Comprender textos orales y escritos de medios de comunicación reales",
    "Redactar textos coherentes y estructurados: noticias, opiniones y artículos breves",
    "Participar con confianza en conversaciones espontáneas y formales"
  ],
  "units": [],
  "exam_prep": null
}
